,number,value,datetime_start,datetime_complete,duration,params_ent_coef,params_gamma,params_lr,params_lr_schedule,params_n_steps,params_net_arch,params_vf_coef,state
0,0,4.313352966962226,2021-04-16 01:46:58.623978,2021-04-16 02:06:18.644097,0 days 00:19:20.020119,0.010369533491220344,0.95,0.04150882946033289,constant,32,32x32,0.2115198015728056,COMPLETE
1,1,3.6394315382157507,2021-04-16 02:06:18.685375,2021-04-16 02:26:07.404780,0 days 00:19:48.719405,0.028330913464855615,0.98,0.0232226449216732,linear,1024,32x32,0.9806015105744489,COMPLETE
2,2,3.154686004694352,2021-04-16 02:26:07.432607,2021-04-16 02:52:25.402332,0 days 00:26:17.969725,8.3801265457561e-05,0.9,0.0006114047997757189,linear,256,8x8,0.8785190369833616,COMPLETE
3,3,3.075751622753857,2021-04-16 02:52:25.429361,2021-04-16 03:08:58.222222,0 days 00:16:32.792861,0.0008985232276707392,0.95,0.05650548425897256,linear,2048,32x32,0.15338749024724008,COMPLETE
4,4,3.3517664488711447,2021-04-16 03:08:58.248432,2021-04-16 03:30:44.775771,0 days 00:21:46.527339,3.6320956089213245e-07,0.99,0.2257698604918741,linear,32,32x32,0.3984565008326928,COMPLETE
5,5,3.8462643285198914,2021-04-16 03:30:44.807516,2021-04-16 03:47:05.461037,0 days 00:16:20.653521,0.00024130305211379248,0.995,1.2238503167772739e-05,constant,2048,16x16,0.11206592081116348,COMPLETE
6,6,3.6578756160254366,2021-04-16 03:47:05.496252,2021-04-16 04:07:57.531640,0 days 00:20:52.035388,2.2513484920904995e-07,0.9999,0.8924500539500467,linear,128,4x4,0.6163295920450698,COMPLETE
7,7,3.0425482314297323,2021-04-16 04:07:57.559294,2021-04-16 04:27:11.140495,0 days 00:19:13.581201,0.0012024932912542289,0.999,0.000609598731870915,linear,16,8x8,0.03354178149120181,COMPLETE
8,8,3.89041595670503,2021-04-16 04:27:11.169150,2021-04-16 04:47:53.958099,0 days 00:20:42.788949,5.1414981958087125e-06,0.999,0.00045331236578311597,linear,16,8x8,0.011935056398015759,COMPLETE
9,9,4.464205044821272,2021-04-16 04:47:53.989218,2021-04-16 05:07:04.970385,0 days 00:19:10.981167,0.08331128967192833,0.999,1.7291522975843825e-05,constant,512,8x8,0.5504460010653925,COMPLETE
10,10,4.266106822207095,2021-04-16 05:07:04.999046,2021-04-16 05:26:16.445762,0 days 00:19:11.446716,1.4145117866574647e-08,0.999,0.0003461944342193696,linear,64,8x8,0.33550130271134576,COMPLETE
11,11,3.418941167234015,2021-04-16 05:26:16.476900,2021-04-16 05:43:15.906910,0 days 00:16:59.430010,0.0011910584100933894,0.95,0.003575119401396805,linear,2048,32x32,0.012554249274856544,COMPLETE
12,12,4.335640403461766,2021-04-16 05:43:15.934769,2021-04-16 06:02:57.714860,0 days 00:19:41.780091,0.0028069958635917364,0.95,0.003580530474243526,linear,16,16x16,0.21722955835714103,COMPLETE
13,13,3.96853360330014,2021-04-16 06:02:57.740491,2021-04-16 06:22:40.889807,0 days 00:19:43.149316,1.5005384331371381e-05,0.999,7.39986330948704e-05,linear,8,4x4,0.0011815520594854467,COMPLETE
14,14,4.479040783758348,2021-04-16 06:22:40.916962,2021-04-16 06:42:08.548805,0 days 00:19:27.631843,0.0005267175216258328,0.95,0.03356894224363177,linear,16,8x8,0.16590808879815477,COMPLETE
15,15,4.233466559465067,2021-04-16 06:42:08.581448,2021-04-16 06:58:32.594055,0 days 00:16:24.012607,0.007646732764047687,0.9,0.009888469943825829,linear,2048,32x32,0.7050838572412322,COMPLETE
16,16,4.4298785733712585,2021-04-16 06:58:32.621209,2021-04-16 07:15:20.907274,0 days 00:16:48.286065,6.965541392238217e-05,0.9999,0.24073705447857294,linear,2048,32x32,0.3637892359113433,COMPLETE
17,17,4.691805086144692,2021-04-16 07:15:20.933974,2021-04-16 07:33:53.417029,0 days 00:18:32.483055,5.335785098956109e-06,0.995,0.0012762378884918965,constant,256,16x16,0.11197118192746532,COMPLETE
18,18,3.3995380061873015,2021-04-16 07:33:53.449470,2021-04-16 07:53:17.735295,0 days 00:19:24.285825,0.08128013540373447,0.98,9.829199149849126e-05,linear,128,8x8,0.26431971104534396,COMPLETE
19,19,3.722591472728221,2021-04-16 07:53:17.764816,2021-04-16 08:12:58.661776,0 days 00:19:40.896960,0.0023606553969650395,0.99,0.14583803096882805,linear,16,4x4,0.4352051345740263,COMPLETE
20,20,3.968469047562354,2021-04-16 08:12:58.688749,2021-04-16 08:32:47.901242,0 days 00:19:49.212493,0.00029408209770195794,0.95,0.009501746836237179,linear,64,8x8,0.09100855762035027,COMPLETE
21,21,3.6505481253927856,2021-04-16 08:32:47.929447,2021-04-16 08:52:24.782557,0 days 00:19:36.853110,3.829129554162046e-05,0.9,0.0008364146419931193,linear,256,8x8,0.945485199353907,COMPLETE
22,22,3.572878594281266,2021-04-16 08:52:24.814894,2021-04-16 09:11:08.850739,0 days 00:18:44.035845,0.00020123968743964528,0.9,0.00015196063118069937,linear,256,8x8,0.8037432894251666,COMPLETE
23,23,3.8756471886242734,2021-04-16 09:11:08.881012,2021-04-16 09:30:20.628733,0 days 00:19:11.747721,8.125619975221727e-05,0.9,0.0014178078255490656,linear,256,8x8,0.8885488039453895,COMPLETE
24,24,3.4020968560298828,2021-04-16 09:30:20.661167,2021-04-16 09:49:19.136696,0 days 00:18:58.475529,0.0010613570906008003,0.9,4.810014702028379e-05,linear,1024,8x8,0.7807219949229779,COMPLETE
25,25,3.9816813783555483,2021-04-16 09:49:19.165878,2021-04-16 10:09:03.926265,0 days 00:19:44.760387,0.00906042954092062,0.999,0.0002603682072129128,linear,8,32x32,0.4990305881578707,COMPLETE
26,26,3.655182839040124,2021-04-16 10:09:03.953287,2021-04-16 10:28:42.015677,0 days 00:19:38.062390,7.922096053128043e-06,0.95,0.002657145686614696,linear,512,8x8,0.276477195306285,COMPLETE
27,27,3.556652090205918,2021-04-16 10:28:42.044417,2021-04-16 10:45:29.663928,0 days 00:16:47.619511,0.00014176696814699474,0.99,3.602233716549876e-05,constant,2048,16x16,0.6538652641058466,COMPLETE
28,28,4.335578181009198,2021-04-16 10:45:29.692085,2021-04-16 11:05:22.191951,0 days 00:19:52.499866,1.2315455304722316e-06,0.995,0.008750769523857078,linear,16,32x32,0.07546837785011108,COMPLETE
29,29,3.5865377781490215,2021-04-16 11:05:22.220465,2021-04-16 11:25:14.444569,0 days 00:19:52.224104,0.023765457562005626,0.98,0.08510809571928861,constant,32,8x8,0.198858338621847,COMPLETE
30,30,3.9350373415163005,2021-04-16 11:25:14.473083,2021-04-16 11:44:25.285455,0 days 00:19:10.812372,0.004160718968991811,0.999,0.0010216149622748946,linear,256,4x4,0.8565659756124736,COMPLETE
31,31,4.0589574618639315,2021-04-16 11:44:25.314875,2021-04-16 12:03:38.221436,0 days 00:19:12.906561,5.239186730815575e-08,0.99,0.9402973817006992,linear,32,32x32,0.4044144474015371,COMPLETE
32,32,2.7672175533885204,2021-04-16 12:03:38.258689,2021-04-16 12:25:00.892766,0 days 00:21:22.634077,9.239745631910495e-07,0.99,0.30342948886057514,linear,32,32x32,0.32324539320276646,COMPLETE
33,33,3.6869975630056304,2021-04-16 12:25:00.921751,2021-04-16 12:44:53.410095,0 days 00:19:52.488344,2.0338100029807683e-05,0.99,0.4360419925033202,linear,32,32x32,0.2490441532737727,COMPLETE
34,34,3.403127809470356,2021-04-16 12:44:53.438638,2021-04-16 13:05:50.685924,0 days 00:20:57.247286,9.456336225044389e-07,0.99,0.053509279036936856,linear,32,32x32,0.30761880665482527,COMPLETE
35,35,4.019544284909949,2021-04-16 13:05:50.714090,2021-04-16 13:24:09.969661,0 days 00:18:19.255571,0.0006758377156178626,0.9999,0.022298603748960987,linear,1024,32x32,0.15597660314411302,COMPLETE
36,36,,2021-04-16 13:24:09.997719,2021-04-16 13:28:59.389319,0 days 00:04:49.391600,1.5194095395596736e-06,0.9,0.46635554614917074,linear,128,32x32,0.05367657321971367,FAIL
37,37,2.452235673971083,2021-04-16 14:26:37.989524,2021-04-16 14:46:38.033798,0 days 00:20:00.044274,1.311053175865557e-06,0.9,0.6079387870199647,linear,32,32x32,0.06723047701471149,COMPLETE
38,38,2.421912117506537,2021-04-16 14:46:38.085459,2021-04-16 15:06:01.390980,0 days 00:19:23.305521,1.1336896392651193e-07,0.95,0.2897853086669377,linear,32,32x32,0.04701346746901086,COMPLETE
39,39,3.5769507562531415,2021-04-16 15:06:01.419751,2021-04-16 15:25:00.977585,0 days 00:18:59.557834,1.2141326655840934e-07,0.9,0.4620378384575975,linear,32,32x32,0.047003672367323904,COMPLETE
40,40,3.4928144854270493,2021-04-16 15:25:01.011379,2021-04-16 15:46:10.384883,0 days 00:21:09.373504,1.813411084335234e-06,0.98,0.5128661974026121,linear,32,32x32,0.002725486655260956,COMPLETE
41,41,3.7190247670947905,2021-04-16 15:46:10.418964,2021-04-16 16:06:39.444266,0 days 00:20:29.025302,4.6375903746485845e-08,0.95,0.11606644257398009,constant,32,32x32,0.06736228161287794,COMPLETE
42,42,4.027365456739657,2021-04-16 16:06:39.475314,2021-04-16 16:25:26.159256,0 days 00:18:46.683942,5.471055316379153e-07,0.95,0.23492750059148895,linear,32,32x32,0.16089937949591776,COMPLETE
43,43,3.1824134394695793,2021-04-16 16:25:26.188374,2021-04-16 16:45:05.342085,0 days 00:19:39.153711,2.1515406672297187e-07,0.95,0.9831805878822387,linear,32,32x32,0.12776661127954217,COMPLETE
44,44,3.978607472054107,2021-04-16 16:45:05.369805,2021-04-16 17:04:42.453267,0 days 00:19:37.083462,1.01128566923811e-08,0.999,0.3333358654124296,linear,128,32x32,0.035676014445346856,COMPLETE
45,45,3.6657001666004634,2021-04-16 17:04:42.484037,2021-04-16 17:21:28.322479,0 days 00:16:45.838442,5.022107735009732e-08,0.95,0.7426016679567856,linear,2048,32x32,0.20075849837546123,COMPLETE
46,46,3.7388676521108772,2021-04-16 17:21:28.352011,2021-04-16 17:43:54.190373,0 days 00:22:25.838362,2.252545876921163e-06,0.95,0.07257844697878041,linear,16,32x32,0.11864684414683699,COMPLETE
47,47,3.6173965612197323,2021-04-16 17:43:54.221124,2021-04-16 18:01:59.185443,0 days 00:18:04.964319,2.9372818741459437e-07,0.999,0.14564380624017376,linear,512,32x32,0.0023610266161130933,COMPLETE
48,48,3.3256511309135477,2021-04-16 18:01:59.240172,2021-04-16 18:21:36.144422,0 days 00:19:36.904250,2.12276378320953e-08,0.99,0.019267750209843934,linear,64,32x32,0.22383999656927978,COMPLETE
49,49,2.493724857651329,2021-04-16 18:21:36.173222,2021-04-16 18:42:06.448646,0 days 00:20:30.275424,9.51141469557165e-08,0.995,0.1987747219757818,linear,32,16x16,0.3187225834573565,COMPLETE
50,50,2.974749672707672,2021-04-16 18:42:06.478725,2021-04-16 19:04:48.605620,0 days 00:22:42.126895,1.0363357450177065e-07,0.995,0.6920939625316987,linear,32,16x16,0.560884754099597,COMPLETE
51,51,3.4222277708192905,2021-04-16 19:04:48.636036,2021-04-16 19:26:13.909077,0 days 00:21:25.273041,9.244227941680876e-08,0.995,0.6355840165870337,linear,32,16x16,0.5242619021993377,COMPLETE
52,52,4.769144525685794,2021-04-16 19:26:13.936712,2021-04-16 19:45:01.461326,0 days 00:18:47.524614,2.136250397529814e-08,0.995,0.2848979095758657,linear,32,16x16,0.5351702621598284,COMPLETE
53,53,3.294484892007772,2021-04-16 19:45:01.492182,2021-04-16 20:05:03.047848,0 days 00:20:01.555666,5.442915392292812e-07,0.9999,0.1948503568477269,linear,32,16x16,0.5675970877291883,COMPLETE
54,54,3.629153984187414,2021-04-16 20:05:03.086296,2021-04-16 20:26:41.275930,0 days 00:21:38.189634,1.0693854711518974e-07,0.995,0.9837714563553512,linear,32,16x16,0.47315592799244544,COMPLETE
55,55,3.75538976463479,2021-04-16 20:26:41.305214,2021-04-16 20:48:14.236026,0 days 00:21:32.930812,2.9349597225557282e-06,0.995,0.35199528773330496,linear,32,16x16,0.607075954777526,COMPLETE
56,56,3.251593703494714,2021-04-16 20:48:14.266121,2021-04-16 21:07:40.289098,0 days 00:19:26.022977,1.8198307213860298e-07,0.995,0.1184765507851058,linear,8,16x16,0.36294683196261895,COMPLETE
57,57,4.291725823079887,2021-04-16 21:07:40.319885,2021-04-16 21:27:19.198557,0 days 00:19:38.878672,4.832607514173772e-07,0.995,0.04003884083659302,linear,32,16x16,0.6652520828695856,COMPLETE
58,58,3.7110660270452085,2021-04-16 21:27:19.236682,2021-04-16 21:46:07.486299,0 days 00:18:48.249617,8.930992458913281e-07,0.995,0.0004238830782921239,linear,16,16x16,0.4525403683805451,COMPLETE
59,59,4.25431845301353,2021-04-16 21:46:07.517829,2021-04-16 22:06:23.394070,0 days 00:20:15.876241,2.6220651686214033e-08,0.9,0.0002391700649309577,linear,32,4x4,0.30515799210898087,COMPLETE
60,60,,2021-04-16 22:06:23.424991,,,3.61827345555142e-06,0.999,0.17139513802595543,constant,32,16x16,0.5690297443583221,RUNNING
